{
  "$schema": "https://json-schema.org/draft/2020-12/schema",
  "$id": "https://sec-review-bot.local/contracts/control-plane-api/v1/observed-run.schema.json",
  "type": "object",
  "additionalProperties": false,
  "required": [
    "run_id",
    "workflow",
    "execution_status",
    "publication_status",
    "created_at",
    "execution_updated_at",
    "publication_updated_at",
    "published_at",
    "failure_code",
    "artifact_storage"
  ],
  "properties": {
    "run_id": {
      "type": "string",
      "minLength": 1
    },
    "workflow": {
      "type": "string",
      "enum": [
        "issue-review",
        "pull-request-review",
        "repository-review"
      ]
    },
    "execution_status": {
      "type": "string",
      "enum": [
        "preparing",
        "recovering",
        "queued",
        "running",
        "succeeded",
        "failed"
      ]
    },
    "publication_status": {
      "type": "string",
      "enum": [
        "pending",
        "publishing",
        "published",
        "failed",
        "skipped"
      ]
    },
    "created_at": {
      "type": "string",
      "format": "date-time"
    },
    "execution_updated_at": {
      "type": "string",
      "format": "date-time"
    },
    "publication_updated_at": {
      "type": "string",
      "format": "date-time"
    },
    "published_at": {
      "type": [
        "string",
        "null"
      ],
      "format": "date-time"
    },
    "failure_code": {
      "type": [
        "string",
        "null"
      ]
    },
    "artifact_storage": {
      "oneOf": [
        {
          "type": "null"
        },
        {
          "type": "object",
          "additionalProperties": false,
          "required": [
            "status"
          ],
          "properties": {
            "status": {
              "type": "string",
              "enum": [
                "unavailable",
                "failed"
              ]
            },
            "error_code": {
              "type": "string"
            },
            "message": {
              "type": "string"
            }
          }
        },
        {
          "type": "object",
          "additionalProperties": false,
          "required": [
            "status",
            "artifact"
          ],
          "properties": {
            "status": {
              "type": "string",
              "enum": [
                "available"
              ]
            },
            "artifact": {
              "type": "object",
              "additionalProperties": false,
              "required": [
                "kind",
                "uri",
                "media_type",
                "digest",
                "size_bytes"
              ],
              "properties": {
                "kind": {
                  "type": "string",
                  "enum": [
                    "diagnostic_bundle"
                  ]
                },
                "uri": {
                  "type": "string",
                  "pattern": "^s3://sec-review/runs/[^/]+/artifacts/diagnostic-tree\\.v1\\.tar\\.zst$"
                },
                "media_type": {
                  "type": "string",
                  "enum": [
                    "application/tar+zstd"
                  ]
                },
                "digest": {
                  "type": "string",
                  "pattern": "^sha256:[0-9a-f]{64}$"
                },
                "size_bytes": {
                  "type": "integer",
                  "minimum": 0
                }
              }
            }
          }
        }
      ]
    },
    "publication_steps": {
      "type": "array",
      "items": {
        "type": "object",
        "additionalProperties": false,
        "required": [
          "step_key",
          "status",
          "failure_count",
          "remote_object_url",
          "failure_code",
          "failure_message"
        ],
        "properties": {
          "step_key": {
            "type": "string",
            "minLength": 1
          },
          "status": {
            "type": "string",
            "enum": [
              "pending",
              "running",
              "succeeded",
              "failed",
              "terminal_failed"
            ]
          },
          "failure_count": {
            "type": "integer",
            "minimum": 0
          },
          "remote_object_url": {
            "type": [
              "string",
              "null"
            ],
            "format": "uri"
          },
          "failure_code": {
            "type": [
              "string",
              "null"
            ]
          },
          "failure_message": {
            "type": [
              "string",
              "null"
            ]
          }
        }
      }
    }
  }
}
