{
  "run_id": "5c1f0a52-3d4b-4e6f-8a91-0b2c3d4e5f60",
  "workflow": "issue-review",
  "execution_status": "succeeded",
  "publication_status": "published",
  "created_at": "2026-10-10T05:00:00.000Z",
  "execution_updated_at": "2026-10-10T05:02:46.000Z",
  "publication_updated_at": "2026-10-10T05:11:09.000Z",
  "published_at": "2026-10-10T05:11:09.000Z",
  "failure_code": null,
  "artifact_storage": {
    "status": "available",
    "artifact": {
      "kind": "diagnostic_bundle",
      "uri": "s3://sec-review/runs/5c1f0a52-3d4b-4e6f-8a91-0b2c3d4e5f60/artifacts/diagnostic-tree.v1.tar.zst",
      "media_type": "application/tar+zstd",
      "digest": "sha256:a1b2c3d4a1b2c3d4a1b2c3d4a1b2c3d4a1b2c3d4a1b2c3d4a1b2c3d4a1b2c3d4",
      "size_bytes": 12345
    }
  },
  "publication_steps": [
    {
      "step_key": "issue:summary-comment",
      "status": "succeeded",
      "failure_count": 0,
      "remote_object_url": "https://github.com/octo/example/issues/7#issuecomment-123",
      "failure_code": null,
      "failure_message": null
    }
  ]
}
